{
  "$schema": "https://json-schema.org/draft/2020-12/schema",
  "$id": "https://github.com/bvrtu/erroratlas/raw/main/data/schemas/benchmark-allowlist-v1.schema.json",
  "title": "ErrorAtlas external benchmark allowlist v1",
  "type": "object",
  "additionalProperties": false,
  "required": [
    "manifestVersion",
    "datasetVersion",
    "generatedAt",
    "repositories"
  ],
  "properties": {
    "manifestVersion": { "const": 1 },
    "datasetVersion": {
      "type": "string",
      "pattern": "^\\d{4}\\.\\d{2}\\.\\d{2}\\.\\d+$"
    },
    "generatedAt": {
      "type": "string",
      "pattern": "^\\d{4}-\\d{2}-\\d{2}T\\d{2}:\\d{2}:\\d{2}(?:\\.\\d+)?Z$"
    },
    "repositories": {
      "type": "array",
      "minItems": 1,
      "items": {
        "type": "object",
        "additionalProperties": false,
        "required": [
          "repository",
          "url",
          "commit",
          "category",
          "license",
          "include"
        ],
        "properties": {
          "repository": { "type": "string", "pattern": "^[^/]+/[^/]+$" },
          "url": { "type": "string", "pattern": "^https://github\\.com/" },
          "commit": { "type": "string", "pattern": "^[a-f0-9]{40}$" },
          "category": {
            "enum": [
              "typescript-node-api",
              "python-api",
              "java-spring",
              "go-http",
              "csharp-aspnet",
              "kotlin-server"
            ]
          },
          "license": {
            "type": "object",
            "additionalProperties": false,
            "required": ["spdxId", "filename", "sha256"],
            "properties": {
              "spdxId": { "enum": ["MIT", "Apache-2.0", "BSD-3-Clause"] },
              "filename": { "type": "string", "pattern": "^[^/]+$" },
              "sha256": { "type": "string", "pattern": "^[a-f0-9]{64}$" }
            }
          },
          "include": {
            "type": "array",
            "minItems": 1,
            "uniqueItems": true,
            "items": { "type": "string", "minLength": 1 }
          }
        }
      }
    }
  }
}
